{
  "protocol_version": "1.0",
  "issue_id": "github.issue.1",
  "repository_id": "github.dec-1st.agent-capability-platform",
  "number": 1,
  "state": "open",
  "title": "Define the first GitHub capability boundary",
  "author": { "actor_id": "owner", "role": "owner" },
  "web_url": "https://github.com/DEC-1ST/agent-capability-platform/issues/1",
  "created_at": "2026-07-20T00:00:00Z",
  "updated_at": "2026-07-20T00:00:00Z",
  "labels": ["protocol", "design"]
}
